{
  "type": "sample",
  "heart_rate": null,
  "breath_rate": null,
  "distance": null,
  "raw_distance": null,
  "total_phase": null,
  "breath_phase": null,
  "heart_phase": null,
  "presence": false,
  "presence_valid": false,
  "presence_source": "waiting",
  "target_valid": false,
  "target_source": "waiting",
  "people_count": 0,
  "target_count": 0,
  "target_x": null,
  "target_y": null,
  "target_distance": null,
  "target_angle": null,
  "target_speed": null,
  "targets": [],
  "light": null,
  "light_ready": false,
  "console_fw": "mmWaveVizLog 0.2.0",
  "firmware_valid": false,
  "firmware_raw": 0,
  "firmware_project": 0,
  "firmware_major": 0,
  "firmware_sub": 0,
  "firmware_modified": 0,
  "led_r": 0,
  "led_g": 0,
  "led_b": 0,
  "frame": 0,
  "last_radar_ms": 0,
  "uptime_ms": 0
}
